Airline,Rating,Reviewer Name,Date,Seat Type,Review Text
Emirates,9-Oct,ar,"08 January,",,"UK SYDNEY ROUND TRIP 
LEG 1 MANCHESTER / DUBAI A380 FABULOUS
LEG 2 DUBAI / BANGKOK B777 OK - TERRIBLE SEATS
LEG 3 BANGKOK / SYDNEY B777 OK - TERRIBLE SEATS
LEG 4 SYDNEY / DUBAI A380 FABULOUS
LEG 5 DUBAI / MANCHESTER A 380 FABULOUS"
Emirates,8-Oct,ar,"10 December,",,"We travelled on a 1 month old 777-300ER from Frankfurt to Dubai. The aeroplane was very nice and had that new aeroplane smell. The staff in Frankfurt were very friendly and even accepted us at check-in, even when it was closed. (We arrived late due to traffic on the highway from Stuttgart to Frankfurt). The crew gave us hot towels prior to take-off, which I found very peculiar especially in the economy cabin. The crew were not very accommodating and friendly though. I asked for a coffee and they blurted out, ""Coffee?!?"" They rolled their eyes and came back 15 minutes later.... What kind of service is this? The attitude and manners of the crew was appalling! For a so-called state of the art airline that everyone keeps on talking positively about, this is not acceptable. Food was tasty and filling , which I always expect on any medium-haul flight. The seat recline angle and space (width) was exceptional. The seat entertainment was amazing with an extensive range of on-demand movies and games, as well as multiple cameras of the tail and undercarriage of the aircraft. Overall, the flight was fantastic, although I would suggest that Emirates should improve on their cabin crews' manners and service skills. "
Emirates,7-Oct,ar,"04 December,",,"I being a student doing my studies in Kerala would travel back to Kuwait during my vacations. I once happened to travel in Emirates, mark my words, it was  a pleasant trip for me to remember. The staff attitude towards the passengers was so remarkable and I was quite pleased with the services provided. 
For those who are reading this comment,  I would suggest you all to chose emirates to travel because its the best flight so far I have traveled."
Emirates,8-Oct,ar,"08 July,",,"Thumbs down to your team - How can you guys charge an excess luggage for Duty Free Shopping.... Yes you heard it right - 5 Kgs Excess Luggage was charged for my 2 bottles of whiskey bought from Duabi Duty Free Shopping. 
$120 - for a 5kg duty free shopping... I would have booked a full suitcase of 23 KGS @ 50$ or 100$.
This is unethical way of looting people... Leaving with no choice at the boarding gates.
A pleasant travel so far ended in a very UNPLEASANT way by #Emirates Airways.... Shocking Excess Baggage Charges for Duty Free Shopping ÃƒÂ°Ã¯Â¿Â½Ã¯Â¿Â½Ã¯Â¿Â½ÃƒÂ°Ã¯Â¿Â½Ã¯Â¿Â½Ã¯Â¿Â½ÃƒÂ°Ã¯Â¿Â½Ã¯Â¿Â½Ã¯Â¿Â½

Friends #- be careful with this airlines... Completely Unethical and Unexpected.

I was on a HYD - DXB - SFO - DXB - HYD.... everything went good until SFO to DXB and from Dubai the staff on the ground to our suprise charged me an excess luggage @ 24$ approx per KG x 5 KGS = 120 $.- U know for what - for the DUTY FREE SHOPPING.

YES - U heard it right, for the duty free shopping done at dubai airport - we had to pay 120 USD as excess fee. The entire shopping was not even costing 100 USD. 
#Refund my money"
Emirates,10-Oct,ar,"16 December,",,"I fly once a year to Europe from Perth and in the past I always flew with Qantas which would arrive at London Heathrow Airport. This final destination was ok but not ideal for my travel plans. Although Qantas always provided me with a pleasant journey I decided to try Emirates as they landed in Madrid which suited my travel plans much better. From the outset I was extremely satisfied with change over. The flight was cheaper and quicker than my previous flights with Qantas. The service, the seat comfort and food and beverage selection was excellent. I flew in business class and was worth the extra money. I was pleasantly surprised to learn that that included  limousine pick up and drop off service from the airport making the whole experience a pleasant, hassle free journey and a real smooth ride! AAAA++++ "
Emirates,10-Oct,ar,"14 August,",,A380 BANGKOK TO HONG KONG and  HONG KONG TO BANGKOK.  May 2014 Business Class. This was our first time on an A380 and first time on Emirates. Our 7 year old loved it and so did my husband and I. The cabin crew were fantastic. 
Emirates,10-Oct,ar,"25 November,",,"on my holiday in Asia i hade 4 flights with Emirates and this was my best flights ever! Good service, nice food, approved legrom (Economy class) i give Emirates 10/10 and one word EXCELENT !!"
Emirates,4-Oct,ar,"07 January,",,"First time flying emirates, and will be the last. Staff were unbelievably rude, unsympathetic and unhelpful at all stages and all levels when we had problems. One supervisor even put her hand up to my face when I was crying to dismiss what I was saying - our honeymoon has been spoiled by emirates incompetencey. What an awful airline with zero customer service! At another point, a man spoke to us and did not even look in our direction let alone make eye contact. Food was average on plane. We still have 3 flights over the next couple of weeks with emirates and I can honestly say I am absolutely dreading all of them."
Emirates,10-Oct,ar,"30 May,",,Everything was perfect.
Emirates,5-Oct,ar,"24 August,",,"A380 LHR-DXB-SYD June 2014 LHR-DXB fantastic service good seats great food! 
DXB-SYD horrific, requested 3 seats together at DXB counter when checking in -check in staff staff rude and unaccomodating - husband was placed on other side of plane many rows away! Food absolutely horrible. Staff rude, more interested in spending time talking at rear of plane. 
We have flown many times with Emirates since its inception and have noticed a steady decline over the years. Lodged a compliant with the airline and did not even receive the courtesy of a reply. 
Now looking at other airlines as our preferred future choice."
Emirates,6-Oct,ar,"03 November,",,"Booked a multi sector ticket with Emirates to Europe and Middle East. Had 3 different levels of service and product for Economy on the 3 sectors travelled, though the aircraft type was the same. How can you NOT get that right! When asked the crew about the discrepancy, was given the answer, 'This is my first flight'. Majority of the cabin crew looked like they had not slept in a week and couldn't be bothered. What a decline this airline has seen. Never again!   "
Emirates,4-Oct,Syed Shaw,"04 October,",,Worst inflight service. Food tray broken. Flight no. EK432 departure 21.15 on 1October. Gum stuck on the back of seat. Staff told us to remove it. Ordered standard meals but Child meals forced to eat. Seat no. 42A economy  Supervisor had no idea. Never saw after reporting.  Never fly again.
Emirates,5-Oct,ar,"24 June,",,"Very surprised by the poor quality of service on board. Particulary on flights between Madrid and Dubai ( Was on a trip to Japan) . Dubai Airport terminal 3 is a complete mess and the business lounge under construction. But this does not explain the rudeness of the lounge's staff and the lado of servirÃ©. Very bad experience, perhaps better to call disappointing once, I will not repeat."
Emirates,6-Oct,ar,"16 April,",,"Return flight from Brisbane to Stockholm, via Dubai.
The part of the journey with the new A380 is quite pleasant. The seating is much better.
The old Boing 777 though, is a nightmare, with faulty entertainment gadgets, totally unacceptable seating, no leg room, no room for anything, long queues at the toilets and overall lacking cleanliness
It just feel cheap and neglected.
The food on the whole flight was incredibly bad, the worst food I have ever been served on any airline.
Staff is undertrained and only when you are lucky you will find someone who is doing his job properly.
shame, because it used to be much better"
Emirates,8-Oct,ar,"06 January,",,"November 25th 2015, It was the most terrifying experience i have ever had. The flight from Dubai to Iran was schedule to depart at 16:10, when the aircraft were just about to be pushed to the runway, captain then announced that there were a technical problem have been found, aircraft needs to be pulled beck for  inspection. After waiting on board for 2 hours, the technicians decided that this aircraft was not safe for travel. So we were deported and been arrange for a replacing aircraft.

Now this is where the horrifying tragedy happened. After taking of with the replace aircraft, in an about 1 hour of time. The business class was on Fire!!! Thank God the aircraft landed in one piece, no passanger was injured."
Emirates,2-Oct,ALIREZA Hassani,"06 July,",,"Before the flight, I called the fly Emirates to make sure that all the things were set and the bassinet for the baby is confirming. The fly Emirates customer service told me that the basinet is booked and the baby will have the basinet for sure. I mentioned the age, size, and weight of the baby. 15 min after the takeoff, we asked the bassinet, and the flight hostess refused the bassinet in terrible behavior due to the baby's size and asked us to keep the baby on the lap for more than 12 hours.
So, we kept the baby on our lap for more than 12 hours which emotionally and physically affect us. In addition, we found that our baby stroller is broken. Oh my god. They refuse to compensate. 
So, I am writing to warn you never fly with fly emirates if you have a baby or kid."
Emirates,9-Oct,ar,"18 November,",,"LGW-DXB-HKG Business Class. The legs between Gatwick and Dubai were in a 777-300ER and I found the seat to be very cramped for a business class seat (seat 8K).  The food was however very good and the ICE entertainment system was second to none.  The air crew were very helpful and friendly

The leg between Dubai & Hong Kong was on an A380.  It was the most enjoyable flight I have ever taken.  The privacy offered by a business class seat (23K), the comfort of the truly lie flat bed, the entertainment on offer, the food and most of all the cabin crew.  There is only one word to describe it - superb.

From now on, I will always try and travel on the A380.  Boeing really will need to get their act together to compete with this plane"
Emirates,7-Oct,Varghese Mathai,"31 May,",,"Those who are traveling from Kochi to US by Emirates May face issues if you are traveling on work visa like L1, H1B etc. While checking my documents at Emirates checking counter at Kochi, the person at the counter asked for I-797. Looking at the 1-797, he called his supervisor and  he in turn called his supervisor who was an elderly lady in Emirates beige and red dress. It created a total mess for over an hour for nothing.

What I understood from conversations is that in the 1-797 it is written that it is not a valid visa document. I tried to tell them that the visa is stamped on the passport but in vain. I believe the staff and hierarchy of supervisors are not familiar with US visas and types. They probably are good with visa categories to gulf destinations but not definitely to US. I never faced this issue traveling from Delhi or Bangalore or heard of anyone talking about it.

Traveling from Kochi, passengers may have to pay for their non familiarity &amp; incompetence on US visa documents. Otherwise, Emirates is a  good carrier and I travelled with them many times."
Emirates,8-Oct,ar,"22 November,",,"i was always the fan, since 80's i used emirates, i have read the news in America that all American airlines are crying because three middle eastern airlines are taking over there business and i always said American airline are shady business but today when i bought me a ticket on emirates i was shocked to see emirates is no more what it used to be ,charges for advance seats unbelievable .last trip with this airline i have to pick another airline since i travel every 6 months"
Emirates,8-Oct,ar,"07 January,",,"Flew return from GLA to Dubai in Economy. Cabin is excellent, great entertainment system with quality personal screen. Drinks free and plentiful. Service excellent.  Only negative was the (""hot"") food was lukewarm/cold on both flights. Overall very good for economy."
Emirates,6-Oct,ar,"04 July,",,"I did not like the crew. They are very unfriendly and make you feel like a customer than a passenger. The crew spilled a cup of water on me because she was running on the aisle, tripped and made a fool out of her self. I wished she had tore her skirt. 

Economy cabin is packed like sardine. Only 8 toilets for a whole cabin of 300+ economy passengers. Avoid going toilet after meal. You don't want to know what's in there. And they don't clean the toilet mid-flight, imagine if you have a long flight. Even a 6 hour flight to Dubai is enough"
Emirates,8-Oct,ar,"09 August,",,Food is excellent inter alia.
Emirates,4-Oct,ar,"17 August,",,"Hi, we travel from Syddey to Bangkok and return on the 4rth of August and 12th of August 2014. Flights were: EK 419 - EK 418.

Our experience was very bad and we will never travel with them again. Here is why:

We booked this flight in February from the travel agent, and I explained I needed a window seat due to a medical condition. They said I had them booked, I rang the agency again one month before flying and they called emirates to confirm again my seats. We arrive at Sydney airport 2 hours and 15 minutes prior departure, there were two people free and they were talking and we had to force our way into the checkin. She gives us out tickets, I ask if they were the seats I prenooked, and with poor manners she told us: ' you better go that counter cause you are not even sitting together!' We go to the help counter and they said that the seats were not guaranteed and they give us 2 seats just in the mid raw. Shocking. Then we go on board and we see that the right side was getting menus. I asked for a menu 3 times, I never got it and no one was able to tell me what was on the menu, at least! Very bad customer service. The seats were very narrow and uncomfortable, the crew was rude. Horrible airline. Used to be much better. "
Emirates,8-Oct,Tony Stark,"13 June,",,"My preferred airline most of the time. I actually use whatever gap I catch. In general, the in-flight was good and the other passengers were very respectful. Frankly, I was a bit overwhelmed on the plane, but this is not about the airline, of course. Overall it was a good and enjoyable trip."
Emirates,6-Oct,ar,"11 February,",,"Traveled between MAN-DBX-SYD and would have to say the standard has seriously dropped. The leg between MAN-DBX was disappointing for my wife as her entertainment system did not work. After an hour of trying to get a cabin staff to to look at it then another hour of resetting they gave up asking my wife to move seat away from the family. The cabin staff were slow and seemed to spend all their time in the galley. They wouldn't answer the call button requiring  you to get up and ask the at the galley for drinks.
The flight from DBX-SYD was no better. The seats we were allocated were right at the back of the plane and the overhead was full of airline products (crew blankets), why on an aircraft the size of a A-380 they have to use passenger space.  We were delayed in departing by 1.5 hrs and during that time they would not let you use the toilet or bring requests for water. 
During the flight the crew did not respond to the call button requiring you to get out of you seat again only to see that they are sitting around  having a good old chat. Good to see that the paying customer comes first, not. Sears no longer comfortable and the foot rest has been removed. Will consider alternate."
Emirates,8-Oct,ar,"06 January,",,My favorite airline
Emirates,8-Oct,ar,"15 December,",,"Emirates published a companion fare which they promoted heavily with their travel agents. I bought a companion fare ticket which was heavily discounted but what the agent didn't know that the companion fare has a stipulation that all the passengers need to travel together or no one can travel. Due to a personal emergency, I had to cancel one ticket but Emirates wouldn't let me do that. I booked the ticket through the top travel provider in the country and talking to various supervisors, none of them had heard of this absurd ""all or none"" traveling. Emirates categorically told me that a single person cannot travel on the ticket if both people are not traveling. This is a money making scam from the airline!

This is my third worst experience with Emirates flying out of USA. I won't recommend them to anyone!"
Emirates,6-Oct,ar,"12 June,",,"Be warned be aware
my family flew to europe from melb in march.  flight from melb was cancelled thus a 24 hr trip became 87 hrs with little care from emirates BUT the big concern is they will not now supply us with evidence the flight was cancelled, will not respond to emails etc from us or the travel agent.  Now waited 45 days and they just send and email saying it will be resolved in 30 days and without this piece of evidence the insurance will not pay out on all of the additional costs etc due to the delay.  . Shocking situation so if you plan to travel with them DO NOT leave the ticket counter if something goes wrong without written emirates evidence of what has happened.  They will not as they assure you provide it later.  Good luck"
Emirates,10-Oct,,"19 January,",,"This flight on in the First Class Cabin from JFK to DXB was a pleasure, on the great Airbus A380. The comfort of the seat was amazing, being that it was like my own little house on a plane, own bar, TV, storage, infinite leg room, and more. The staff was more than friendly and nice, they were there for your every need, and sometimes travelling alone could be lonely, they're there! The food was great and so was everything else. Emirates, great job."
Emirates,4-Oct,ar,"19 July,",,"I fly a lot and different airlines. I was told that I should fly on emirates because it was Ramadan and I was fasting and had my kids with me that the flight would be easier. But this trip turned into one of the worse that I have taken EVER. It started out with my daughter asking for water and the crew member came and turned said ok and turned off the light and never came back. An hour lasted she asks for water again and the crew member comes back and said we will be passing out water soon. 25 min they come by with water... Ok... I was fasting because it was Ramadan and when it was time to break my fast they gave us 3 dates and a bottle of water and that was it. When we asked for food they said that it was not time for food?!?! I informed them that I was fasting and they now exactly when it was time to break yet they didn't offer us any food. My daughter went looking for food and came back with an apple. And that's what I ate. It was time to fast again and when i asked for food I was told they will bring the breakfast out shortly. Well it came out about an hour after the time for fasting started. I have never experienced such disregard for a person on a flight before. 

EDITORS COMMENT: When flying in economy you really can't expect food on demand for religious or health reasons. You need to bring your own if you need to eat at a certain time. It's simply not practical to have economy passengers choose when they do and don't want to eat. "
Emirates,10-Oct,ar,"03 July,",,"My wife and I travelled on 21 June 2015 via EK775 - Emirates Airlines T-Economy.  I cannot rate the entire flight highly enough.  Everything was of the best standard.  The cabin crew members were of equally this highest calibre.
For instance one of the Senior Stewardess, Alessandra, was incredibly good to all passengers, including my wife and I.  She was unfailingly polite and smiled readily.
Nothing at all was too much for her.  She was extremely efficient.  She is certainly the best stewardess whom I have encountered on very many flights.  I commend her highly to her superiors.  
Regards Gavin Gow (Durban, South Africa)"
Emirates,9-Oct,ar,"04 April,",,"it was very good experience
 "
Emirates,3-Oct,ar,"06 December,",,"Pathetic service, unhelpful staff this is what my experience is! I booked a stop over in Dubai and availed their visa service. What I have ended up is more than 1 week my visa has not arrived, my flight is tomorrow and emirates staff has no clue what they  are supposed to do. Extremely disappointing! And not only this, now they are asking me to reschedule my flight and pay the fee, seriously! This is why u offer this service, to make money out of it. For me emirates is a big NO NO!"
Emirates,8-Oct,,"29 January,",,"Tutto perfetto, dal servizio alla qualitÃ  del volo; partenza e arrivo puntuali, i 4 motori dell'airbus A380 danno molta sicurezza. Quando possibile prendo sempre questo gigante dei cieli targato Emirates."
Emirates,5-Oct,ar,"16 August,",,"I will never again fly with this airline. Two reasons: luggage allowance and in flight service.
1. I will never forget the shock I got when I checked in my luggage. Normally airlines allow one piece of checked in luggage and one carry on when you fly intercontinental, and then they charge you per extra piece of luggage. But no Emirates, these guys allow only 30 kg checked in and 8 kg (1 piece only) carry on, any everything extra is charged 100 USD per kg. Since I also had my backpack, I would only carry on that, and had to check in my two suitcases and one carry on. I had to pay the price of one more flight for for the extra luggage! That is absolutely insane.
2. The flight attendants were some young crowd looking for partying around the world, and they kept talking out loud in the back of the place (I was seated in the back so could hear them the entire time) about how the only reason they took the job with Emirates is to see the world. Apart from serving meals, they rarely passed through the plane to see if passengers needed anything (like water). Very immature service level."
Emirates,8-Oct,ar,"09 June,",,"My main gripe is about their last-minute ""upgrade to business class"" offers. This is essentially a great idea. Fill the bizclass seat. And I was actually happy to pay the extra $2000. But their stoooopid marketing people chose to exclude not only the chauffeur driver (which could be accepted). But it also said: NO BUSINESS CLASS LOUNGE ACCESS. Now am I stupid, or is this one of the main things we pay for when going biz class? Emerites has stuffed up badly here. I have chosen to stay in cattle class if Idon't get my business class lounge access. Bad call Emirates!"
Emirates,8-Oct,ar,"24 August,",,"PER-DXB-FRA-DXB-PER

Excellent flight. Good service and no hassle to ask for anything. The IFE was called ICE and it had a wide variety of music, movies, TV and games. The only bad thing was in Frankfurt we couldn't access the Emirates lounge since we had booked with Qantas, but it wasn't a big deal. Would I fly with them again? Of course. "
Emirates,5-Oct,ar,"01 December,",,"We flew Emirates from Manchester to Auckland via Dubai, and returned from sydney back to Manchester via Dubai. From the last time we flew with Emirates standards for inflight services have certainly dropped.
On our recent flights the planes were cold and despite having blankets the passengers in our area resorted to wearing coats and hats! The crew were unable to tweak the aircon. No blankets were available from Brisbane to Auckland so we shivered for three hours.
The food quality and choice was terrible. Meaks were cold, of poor quality and on all our flights we didnt receive a meal of choice at anytime. Little point in giving out menus when there are no choices available.
The fritatta and sausage breakfast will go down as the worst ever in flight meal.
The flights ran out of beer and wine and gone are the days of more than one drink round.
The cabin crew seemed to be distracted and disinterested.
What is happening to what we once considered to be the top quality airline."
Emirates,9-Oct,ar,"03 February,",,"Manchester to Perth A380 & Boeing 777
There's no doubt that every aspect of an Emirates journey is remarkable, right from the moment you check in. As a passenger you are provided with just about everything you could hope for when travelling economy, from friendly service to nifty little extras like ""please wake me for food"" stickers to put on your chair and luxurious hand lotion in the lavatory. The only thing I could ever fault about one of my journeys was when a steward refused to serve me a glass of wine by blatantly ignoring my request at dinner and laughing it off. I called him back and he very awkwardly asked me to show some form of ID that I was over 18 years of age. I am of course, 26 years of age and found this quite embarrassing to be ID'd on an aeroplane with everyone looking at me like I had committed a terrible crime for asking for some wine!"
Emirates,10-Oct,MD Farid Faidzal MD Yusop,"19 February,",,"Took a flight from Kuala Lumpur to Dubai on Emirates 777-300ER and stopped for transit for almost 8 hours before took the Dubai to London Heathrow on the awesome Emirates Airbus A380. A total flights of almost 15 hours on Emirates has left me with a wonderful &amp; memorable experiences. From the check-in process in KUL - check-in at Dubai, then the wonderful services on both fleets, amazing in-flight entertainment &amp; services, in-flight gifts such as travel pouch, passenger handling services, the in-flight duty free goods (which i bought Emirates goodies), embarkation &amp; disembarkation of pax on both flights simply was amazing...I will surely fly with Emirates again to any destination. Because the experiences that the crew, flight crew &amp; everyone, has made me fell in love with Emirates/."
