Airline,Rating,Reviewer Name,Date,Seat Type,Review Text
British Airways,7-Oct,ar,"29 December,",,"My mother who is 70 traveled on BA on the night of the 5th of December 2015 from Boston Logan airport to Heathrow.  She landed at 8 am.  Despite booking wheelchair services, she had no-one to assist her at the airport.  She missed her connecting flight to Mumbai as it took her longer to reach the check in counter.  Also she was subjected to security check but was at the end of the queue.  No one paid any attention to her or the other passengers who had to catch their connecting flight.  Having now missed her flight, she was given a Ã‚Â£10 coupon for food and drink.  She had to sit in the transit lounge of Terminal 5 on high back chairs.  The flight to Mumbai was at 9pm on the 6th.  I feel that the way British airways ground staff were useless.  The customer services were totally inadequate in providing me any telephone numbers to be able to contact her in Terminal 5. We were totally disgusted with her treatment and vowed that none of us will fly BA on a long haul flight."
British Airways,9-Oct,James Tozer,"14 November,",,A380 was quiet smooth very comfy seats and decent food. Slept better in economy than many airlines in business. Note that the only this BA do wrong is to Codeshare with American Airlines.
British Airways,10-Oct,ar,"27 March,",,"Always choose BA from London to Greece and the opposite .
Sometimes my flight has delay"
British Airways,6-Oct,ar,"12 June,",,"My kids flew from DFW to London-heathrow on unaccompanied minor service.
the service was not so sofisticated as they explained in there website.
1.There was miscommunication at DFW airport.The person issued the boarding pass communicated saying BA member will pick kids from lobby and take them for boarding directly,we were waiting and finally no one showed up,when checked back with BA member ,they said that is not the process, and she issued gate passes to us 30mins before the takeoff.
2.The unaccompanied forms were not sent to the gate desk  .
3.AS per the details mentioned in the website ,they said kids will be provided seating close by to the cabin members,but the seating were in 10th row.
4.When kids reached the Heathrow airport ,kids didnt receive any assistance during baggage claim,kids had to pull the baggage and place in the cart."
British Airways,5-Oct,ar,"09 January,",,"Firstly they offered no juice or drinks throughout the 10 hour flight from New Delhi to London(01/06/2016) .They serve dinner but as the child is sleeping they don't serve her .Breakfast in the morning was served very late and since my child was hungry ..All I got was a bag of crisps ,later when she didn't have the breakfast ,they said we don't have anything else to offer .The omelette was too heavy and the croissant was unpalatable .No fruit or juice was served .After requesting nearly thrice for a bar of chocolate (at least )all I got was a rude reply that we offered you milk .If your child can't have milk how can she have a chocolate?Or else buy chocolates when you get down at the airport..I was appalled by their behavior and their indifference ..Also if you ask the flight attendant about the menu they reply ""some vegetarian meal with vegetables maybe ..They do not know the menu at all ..My second flight from London to SFO was much better .Yet the Inflight entertainment was not working for a nearly 11 hour flight ...Is it cost cutting at its seasonal best or yet more to come..would not recommend this airlines to anyone."
British Airways,7-Oct,ar,"31 October,",,"I travel to the UK several times a year to visit my boyfriend. I've always flown BA, and my only complaints are their extortionate prices and seats which are difficult to sleep in (even when you're 5'0""). The staff have always been friendly and professional. I've always felt safe and calm when flying with BA, and I am not one who typically enjoys air travel. Overnight flights in economy are never particularly comfortable, but it could definitely be worse. The meals provided are good for an airline (I always stick to pastas), but the entertainment choices are sometimes limited (though very British). I've experienced a few delays and one cancellation, but typically we arrive in a timely manner. I just wish the flights were cheaper; it's rare that they fall below $1,000 round trip. But for a nonstop, transatlantic flight, I suppose that's not bad. There are definitely other airlines that do nonstop transatlantic flights for cheaper (Virgin, for one), but if BA is your only option it's certainly not a bad one. Personally I think you get less than you pay for in economy, but if you're not terribly picky and just want to reach your destination safely and decently-fed, BA's great.

EDITORS COMMENT: Thanks for sharing your very balanced and informative review - great to read."
British Airways,9-Oct,ar,"14 February,",,"I arrived 10 minutes to closing the check in to my flight to Los Angeles with lay over in London, had forgotten my student visa and was freaking out. I was pulling out everything of my suitcase to find the visa but to no avail. The stewardesse then saved me, held the flight giving me time to fill out the ESTA and when i lost my boardingpass running to make the flight, and my bag broke and everything fell out and i fell hurting my knee, the British Airways staff was the kindest, most helpfull and overbearing crew i have ever met. I can sincerely say that I had not made this flight, which meant everything to me to finish my Masters Degree, if it hadn't been for the Danish and British crew on that Nov 8th flight from Copenhagen to London. I'm deeply grateful for handling and helping me in such a panic state. I was shaking and almost crying in my panic attack, walking onto the plane. The stewardesse immediately saw me and pulled me aside as i was entering the plane 30 min late. She gave me water and demanded i stood by her until i had drinked two cups. She smiled and calmed me down so patiently and kind. Wow, thank you - i don't know your names, but it meant the world to me!! "
British Airways,8-Oct,ar,"16 February,",,"Flew London City to Glasgow International Airport and back. Mobile check in was a breeze. Seats and leg room was good for my comfort as a 5ft3in. Flight attendants and check in counter staffs were helpful, but not friendly enough to me. Take off and landings were excellent as well. I intend to fly with them back to UK in the summer. "
British Airways,6-Oct,ar,"21 January,",,Flew Business from Singapore to Sydney and was most dissappointed with the seat configuration being placed in two centre seats. Service was adequate but the cabin staff didnt go out of there way to provide service.
British Airways,6-Oct,ar,"17 July,",,"Was absolutely shocked to find there is no food on any flights under 5 hours, always looked forward to the breakfast. On top of that they've scrapped the unnaccompanied child rule which no makes it harder to see my younger siblings.

Flown this airline for 10 years, now is when I stop. Crap value for money, Mr Cruz is Clueless."
British Airways,5-Oct,ar,"11 September,",,"Upgraded to Club Europe on outward journey for a treat. Check in queue at ""dedicated Club Europe"" desk dreadful. Staff like bouncers with no customer service skills. Heard one say to a young man ""you should have got up earlier"". Only when we got restless did they open the fence to let us go to an idle check in operator. Then the ""priority"" security process was nonsense, just as slow as elsewhere. Staff on board excellent.
On return journey I checked in online as usual. Changed our seats to the final row. Got on board to find the row had no window. Flight to full to move elsewhere. Partner a very nervous flyer and had a horrible journey back, felt he was in a coffin. All made worse by 30 min delay on departure and a further 30 min delay on being allowed to land at LHR.
Next day I contacted BA customer services online to ask why there was no indication at all on the aircraft seat plan that row 25 on Airbus 319 had no window. No response at all apart from automated ""we're busy but will get back to you asap"". A week letter I sent the same response, with original complaint number, again online. No response at all, not even the automated one.
I'm left feeling that BA is now RyanAir."
British Airways,0 / 10,Alison Spencer,"09 August,",,"Dreadful airline that has got worse over the years. Oversells its seats and has no one to deal with this. Loses baggage. Has no hot drinks nor sandwiches on short flights.
Unlikely to ever use again."
British Airways,10-Oct,ar,"02 March,",,Travelling as a disabled passenger with mobility needs and special dietary requirements I was apprehensive.  From the moment I arrived at the airport I was treated with extreme courtesy and help at every point. I particular on the flight from Tampa to Gatwick the cabin staff were exceptional. I would like to comment on the Cabin supervisor Nicola Hooper who went out of her way to ensure I was comfortable and well taken care of.  Such a joy to find traditional service standards are still in place. I know why I never travel with any other airline. It is predictably excellent.
British Airways,7-Oct,ar,"17 November,",,"I booked flights with BA from London-Kuala Lumpur-Bandar-Kuala Lumpur-London. These were all booked at the same time and they also took the booking, therefore contract, with Royal Brunei Airlines (RBI) for the KL/Bandar/KL legs.
For whatever reason RBI cancelled one of the flights, and it was only by accident that I found this out, by going on the BA website. I had to change a flight and waste a day in Brunei.
BA have refused all responsibility, even on the lack of communicating the cancelled flight to me. I find this deplorable after booking everything through BA.

I would certainly never book anything direct with BA again, as this lack of service by a major carrier to a customer is despicable."
British Airways,7-Oct,ar,"12 August,",,"The British Airways flight staff were absolutely wonderful!  The food was great.  The plane, however, was old and the in-flight entertainment sub-par.  The sound and video quality of the movies were scratchy and fuzzy.  I had to keep adjusting the arm of my chair just to get enough sound to hear the movie.  People should be advised to bring their own entertainment.  "
British Airways,3-Oct,GORDON YONG,"31 August,",,"flight from US city to Heathrow T5 for transit to Naples; Milan to T5 and back to US city.  BA website for online check-in not working as per standard SOP for many airlines. Fee required to select seats. Aerobridges must hate BA planes.  Besides the US city, none worked in Europe or BA went cheap. Seat planning is atrocious. Was seated with anti-social parents with kids at my front and back on return. Hellish flight, hardly got sleep and attendants did nothing to curb noise levels from this family.  Would not select BA again."
British Airways,9-Oct,ar,"20 March,",,"Edinburgh to London Heathrow - Check-in was excellent friendly, efficient & very helpful, was taking Qatar Airways out of LHR the following day & now that they are Oneworld members BA were happy to check bags all the way to Dubai even with overnight at LHR.
On the flight, very clean & well presented A321 - plenty room for this short hop, Cabin Crew again very friendly & efficient - same on my return A320, couldnt have been more pleased - Thanks BA"
British Airways,6-Oct,Mary Aubertin,"30 November,",,"I flew Business class to and from Europe on American Airlines and British Airways.  The sleeping accommodations on the AA plane were much more private and comfortable than on the return flight on the British Airways plane.  The food on the AA plane was much better.  The food on the BA plane, except the Bangers and mash and the chicken, was abominable, absolutely horrible.  I would not fly BA again if I had to go through Heathrow and my final destination of Vienna.  There were no jetbridges to the planes. I had to walk up numerous steep flights of stairs in the terminal and on the tarmac into the plane carrying a moderately heavy carryon.  I also have knee and foot medical problems and some dizziness after a fall while I was in Europe, so those stairs created a dangerous situation for me and undoubtedly for the elderly patrons who were accessing and egressing the planes.  The ground transportation was crowded and in the era of covid, unsafe."
British Airways,8-Oct,ar,"14 October,",,"I took a short flight from Ibiza to London, The staff actually had a sense of humour. The crew on the flight deck were very informative of any changes in our situation including the weather. Full service with a meal and drinks on a 2 hour flight. This was my first flight with this airline.

EDITORS COMMENT: Sounds like a pretty good flight!"
British Airways,9-Oct,ar,"12 June,",,We flew from London Gatwick to Alicante in May and the flight on-board the 737-400 was excellent the staff were friendly and helpful and the aircraft was clean and comfortable. We received a lovely free in flight meal rare now due to low cost carriers as well as a free hot drink. It has to have been the best short haul flight I have ever been on.
British Airways,4-Oct,Alireza Nasser,"11 March,",,"Delayed flight, long wait in transit for over 12hours with a senior and 6 children, no empathy only to be informed two of us couldnâ€™t board the connecting flight due to no e-visas which wasnâ€™t accounted for at boarding from home country. Stranded in London for 3 days with no bags. Wife and children separated from me and stuck in another country all alone. Extremely rude staff. When filed a claim upon my return all they did was apologize for their rude staff and inconvenience and ask for receipts as proof which I didnâ€™t have due to the chaotic nature of the journey and therefore they denied my claim with no compensation. I donâ€™t understand how they expect 9 passengers to have lived unexpectedly in foreign countries for 3 days without any expenses? Shame on BA because I will never fly with them again. They did nothing to make this matter right."
British Airways,9-Oct,Caspar Burgess,"31 August,",,"Very high quality experience. The seats are comfortable, the food is good and usually the trip is smooth. Would recommend"
British Airways,4-Oct,Ken Murray,"09 August,",,"Poor customer experience in Club Europe - no priority boarding, poor food quality and they said that they didnâ€™t have Champagne (as advertised) due to â€œsupply issuesâ€."
British Airways,8-Oct,ar,"06 October,",,"Inbound flight to PHL via LHR in Coach and World Traveller Plus was quite ok. The hospitality and the kindness of the staff is widly spreading. One flight attendant hit me with his cabin scooter and did not even excused himself whereas another one was extremely kind in helping me with some issues at my seat.
The outbound flight was quite bad. World Traveller Plus cabin was overbooked (which seems to be the reason for the trouble that I had with reserving seats - see below). Instead of just upgrading the people (business  was only half full) they tried to find some people for using the next flight. Caused delay as no one wanted to use the next one (as this was the last flight out of PHL for that day).
The experience on board was very good this time.
Food is very good in World Traveller Plus.

My biggest problem with BA is customer support: I had problems with getting a reservation of a seat. I tried to select a seat (no bassinet!) that was shown  as free and get an error message. Two times I contacted the customer service hotline but there were not able to help and I got another information every single time. My complaint email was not answered till now (four weeks now)."
British Airways,6-Oct,ar,"05 October,",,"Over four hour delay which was entirely British Airway's fault and down to engineers being called out and paperwork taking a long time to be signed off. Long distance flight to Qatar.  I have written over eight communications to British Airways Customer Service to claim compensation. It has been almost two months and not a single communication has been acknowledged- whether by online form, email or hard copy letter posted by recorded delivery. Waiting over half an hour on the phone to speak with Customer Relations. This is incredibly poor customer service. I'll be avoiding BA going forwards. - very negative experience."
British Airways,5-Oct,ar,"12 August,",,"After booking a quick, half emergency return ticket at the airport, for which I payed about 600 euro's too much, I had to change the date and place of return.
Spent 6-7 hours on the phone with different people all telling me different things. One person said changing is possible, the other person said it was not. One person told me I can cancel the ticket, another told me I can't.

They just threw random information at me all the time and couldn't help me, I was unable to change my ticket in any way I wanted - and it was a very reasonable request, within a 15 day time span.

Bedause I booked it at the British Airway desk at the airport, the ticket was registered as if it was booked by a travel agent. However, I did not get the promised email or information, and could not contact this desk at all.

In short, I just feel scammed. I've been toyed around with and they sucked all the money out of me they could. For the first and last time, as I'm spreading the word joyfully that this airline is one to avoid at all costs."
British Airways,5-Oct,ar,"25 February,",,Unfortunate to have paid a huge amount to travel economy from  Arlanda Stockholm. To T5 Heathrow. You have to pay for a cup of tea and your food. The flight crew were rushed off their feet. Ordered food at start of flight and had to chase it twice and received it when we were nearly home.  There was little chance to buy any duty frees even. It's EasyJet service at extortionate prices and they are not even anywhere as good as EasyJet! Had to provide passport details  along with my credit card details for products under Ãƒâ€šÃ‚Â£30.00. Would never use again out of choice. Absolutely awful.
British Airways,6-Oct,ar,"12 February,",,"On Wednesday 27 April 2011 a travel agent advised my wife of a fare of $796,
on British Airways, saying that it would be necessary
to book and pay by Friday 29 April.

That evening I looked on the British Airways website and at an online travel
agent's website, and confirmed this information (the fares varied slightly,
which I took to be slightly differing agent's commissions).

On the following day (Thursday 30 April), after we had planned a trip,
this fare appeared to be no longer offered,
but a fare of about $915 was offered instead.
(after checking two travel agents and the BA website,
which again, offered very similar fares).

The discrepancy in amounts was not due to changing availability of seats -
mostly the above information relates to what I was told before we looked
at which dates the required number of seats was available.

That is, they advertised that a fare would be available until Friday,
and then discontinued it basically overnight.

This seems like ""bait advertising"", which in the case of retail shops in Australia, is illegal, and certainly unethical.  It certainly had that effect - getting me
to come along having planned a purchase, only to tell me the price was more
than I had, based on their advertising, confidently expected.
EDITORS COMMENT: Generally you will find that in the fine print it will say ""until set number of seats has sold"" or something to that effect. It is frustrating though but every airline does it"
British Airways,9-Oct,ar,"28 March,",,"I would like to give an extra mention for a young man by the name of Julien Cadoret. He gave above and beyond service and made my journey more enjoyable
Regards
Dee Cullen"
British Airways,8-Oct,ar,"07 November,",,"Qatar-Bahrain, It was a very short flight, hard to write home about it! but I will be fair to them, they were very friendly and accommodating! It was a total shock as I had horrendous experiences with other European carriers and I do my best to avoid them. Legroom was good, flight on time, and we got a soft drink for a 15 minutes flight, would fly them again due to low price."
British Airways,3-Oct,ar,"13 April,",,"I was very disappointed by BA.
First of all, we had a delay of almost one hour which is unacceptable. I'm not absurd, I can accept a delay of 10-15 minutes, but not an hour.
When we were finally ready for take off, the passenger seated in my front, lowered the back of his seat (which it's forbidden) and when I asked the flight attendant to ask the passenger to raise it, he said with a superior attitude ""We are not flying yet"". The airplane was already on the runway ready to take off.
When was time to serve the food, they said ""We have only Chicken Curry"". How is possible to have only Chicken Curry? What about the vegetarians and vegans? It's outrageous to serve only chicken curry!
I'm very disappointed and this was the last time when I will fly with BA!"
British Airways,5-Oct,ar,"09 December,",,"Just returned from flight by British Airways (First Class) from Delhi to London.
Complained to BA about the following: delay in boarding, tv system not working properly and only having one meal and snack for a 9 1/2 hour flight. Could not even supply cheese and biscuits. Airport Lounge used in Delhi ok but not a great variety of meals on offer.On the flight I expected air staff to offer to turn your seat into bed and dim the lights for the flight. This did not happen and on arrival had to wait 20 mins for luggage and when I asked BA staff at Heathrow just said they could not do anything it was the way the plane was packed in Delhi and continued with their conversation. We were lucky enough to fly with Virgin last year and it was tons better.
Wish I had gone with Virgin again. Did complain to BA and had to wait for four days before I got a reply from customer services who basically said will pass your comments on to various departments but no apology. Definitely not worth the money to fly in first class.

EDITORS COMMENT: The baggage thing really is out of the airlines control I agree with that but as for the rest of it I too would have expected those services you mention on a first class flight!"
British Airways,4-Oct,,"11 January,",,"an absolute shambles at Frankfurt airport coupled with a complete indifference from British Airways staff left us in a queue which took longer than the time available to get to the plane. An extremely rude member of staff then proceeded to lie to us about calling all passengers for London City, yet this simply wasn't true. plane took off with just 16 passengers on board. British Airways reluctantly re booked us on a KLM flight the next day which was so much better than the very indifferent British Airways flight."
British Airways,6-Oct,ar,"11 May,",,"I was very disappointed that during my 4 hour flight from Athens Greece to London, I was required to buy ALL drinks/snacks an food, as was everyone else on the flight! Not even water was offered! Everyone had to pay high prices for food and drink on board with a credit card! Even the smaller European companies offer free food and drink on their European flights... shame on BA!!"
British Airways,5-Oct,Paul Swain,"04 July,",,"Years ago I swore to never fly British Airways again due to their shocking service, attitude and flight cancellations. I decided to recently give them another go for a flight from Nice to London 11.50am arriving 12.40pm so I could attend a meeting in the afternoon, only to have BA cancel my flight at the last minute because they didn't fill the plane and putting me on another flight at 8pm than night getting in at 10pm!!
What am i meant to do with that! I only have two days in London and my itinerary is tight.
So I advise go Eazy Jet or Wiz as they are of the same standard only much cheaper. save your money and don't fly BA."
British Airways,2-Oct,Andrew Peachey,"09 August,",,"My flight with BA from Gibraltar to LHR was cancelled several hours prior to departure. I had a connecting flight booked from LHR to Vancouver the following day, so it was imperative that I got to London. I checked the BA website and couldn't find any other flights with them that would work, so unfortunately I made the mistake of requesting a refund. I managed to find a flight out of Malaga that got me into London just after 10:00 p.m. so I booked that and then called British Airways as I wanted to discuss compensation. That's when they advised me that because I had â€œabandonedâ€ travel with them, they were not prepared to do anything for me. Apparently, I should have called them first, and then they would have made the arrangements. Of course they don't explain that on their website - they just ask if you want a refund and then proceed. When I plead my case with the agent at Malaga airport and then followed up with Customer Relations several times via email, they flat out refused to budge. I ended up incurring costs of Â£700 in airfare, hotel, and meals. This airline has definitely gone downhill."
