Airline,Rating,Reviewer Name,Date,Seat Type,Review Text
Emirates,6-Oct,ar,"02 January,",,"I came back from Turkey to Dubai on Emirates flight I had a horrible expreience the flight was delayed and when it landed there were many empty parkings connected to the airport available instead the aiplane parked at the very end of the airport after terminal 2 which took 15-20 minutes with the bus to get to terminal 3 and this is not the first time it happens, in fact I cant remember the last time Emirates didnt use the bus. The customer services as always horrible espicially when in Economy class and even in Business the staff can be rude, they are extremely rude to you if you're a local. Food is not so great I only eat because I am hungry. The prices are overrated and not worth paying. The only good thing about emirates airlines to me is that the airport is located 10 minutes away from my house. I'd rather fly on Etihad airlines and get on the road for an hour and a half to Dubai instead of using Emirates again."
Emirates,6-Oct,,"30 November,",,"I had the displeasure to fly Emirates Melbourne to London via Dubai , Then London to Mauritius via Dubai . Finally Mauritius to Melbourne via Dubai . Conclusions ...Unless you fly First Class your treated like cattle , in Cattle Class . I had to fly economy because First Class was book out solid and I had a time schedule to meet that could not be changed . The best part of the trip was Mauritius .....Like heaven on earth if you look for it . As for Emirates ....very cheap very nasty LIKE MELBOURNE AIRPORT , No airport rail link ....so 3rd world . Would gladly recommend Qatar , Cathay or Singapore Airlines ."
Emirates,6-Oct,ar,"09 April,",,"Not impressed with the service, specially as I was travelling business class from Dubai to Hong Kong, dirty glass, asked to get it changed, was told by the stewardess that she will bring a clean one, never did, had to ask again. Asked for a bottle of water later on and again was told they'll come back with one, had to ask again.
Apart from the friendly welcome when I boarded, I can even remember being asked if all was all-right from time to time."
Emirates,8-Oct,Franco Lavagnini,"12 October,",,Mai avuto inconvenienti.
Emirates,5-Oct,ar,"25 August,",,"Beware of misleading information on Emirates web pages - Manchester to Dubai flight.  Not sure if this is normal but we were offered only one refreshment on the overnight flight to Dubai and no tea or coffee or snack or drink in the morning.  No menus.  Complained to customer service who said they would investigate in 40 days - chased after 50 days and said they were behind.  When response came they said it was because of turbulance (when there wasn't any).  They said that refreshments are offered on all flights, so they obviously had not even read the email explaining that we had only one offered before our meal and that was it for over 7 hours. We had to go straight to Costa Coffee at the airport to find a drink on arrival."
Emirates,4-Oct,ar,"20 October,",,"Flew from Manchester to Auckland, arrived at Dubau and was raced through the airport at nearly at a run, being nearly 68 and my wife suffering Parkinson's we were told just hurry, we were treated cattle by a local employee called Peter the food on the flights was discraceful they sold a seat which was supposed to be blocked according to checkin desk, which was a total lie, the cabin staff left a lot to be desired hardly saw them I was told Emerates was the best but having flown by cheaper airlines they have a long way to go to match them, I would never recommend Emerates to anyone and will certainly never use them again, give me Singapore airlines any day.

EDITORS COMMENT: A seat can never be guaranteed to be blocked  - if they need it they will use it. Running through the airport should have been done with a little car to assist you but unless they know on the booking that there are health issues they will assume that you are fit and healthy to get your own way to gates even if you have to rush. "
Emirates,5-Oct,ar,"07 April,",,"Unorganized, chaotic, uncaring n souless service. The way families with young children were treated was absolutely disrespectful. Splitting our family up in the seating and squashing us in with the middle seats with an 18 month old baby was horrid, for us and the 2 poor people either side of us. The whole boarding process was a complete shambles and any questions fell on deaf ears, or the staff couldnt give an answer so they play ignorant. The less said about pilot skill the better. Small tip...ground level when landing is not 5 metres below the ground. We bounced more than a trampoline...i had such excitement at using Emirates for the 1st time. Now, with so much disappointment, it will be the only time. Never ever again. If that was your worst, i couldnt imagine your best being that good...wouldnt bother spending the extra money to fly with them. Not when the service is worthless. Nothing but headaches n stress which is the last thing you want when trying to get home after a long holiday. "
Emirates,10-Oct,Sabastian Ihekweme,"07 July,",,"Emirates is really wonderful. Seriously, fly them and you will find out that i'm actually underrating them by saying they are just ''really wonderful''. The cabins are neat, fine and comfortable, the food is great, the staff are nice and lovely and the In flight Entertainment, themed ICE, is excellent. I think the name ''ICE'' is really thoughtful- Information Communication Entertainment. Emirates is a very generous airline and patronizing them is worth every dime you spend. I've never entered an airline better than Emirates."
Emirates,10-Oct,ar,"22 March,",,"On behalf of my family, I would like to thank the staff and airline of Emirates outbound flight EK405 on 16/3/2016, 7PM.
The care and attention you provided to my family in economy was five star.
You were kind enough to let my son Nicholas who has a disability (Autism) to board before the other passengers, which ensured he would have a pleasant flight experience.
Thank you for allowing us up into the Business Class Deck to see just how the other half live ... hahahahaha..... it was amazing, and the cocktails were out of this world, delicious. Thank you Anu for arranging this ( I hope I have spelt your name correctly), you made a very big impression on my young son. Nicholas who thinks that all of the Emirates women look so pretty in the uniforms, especially the hats and scarves.
Thank you, we will certainly fly with your airline in the future."
Emirates,10-Oct,ar,"16 December,",,"Tutto perfetto, se c'ÃƒÆ’Ã‚Â¨ un modo per coccolare i passeggeri sui voli Emirates lo troverete. Il personale ÃƒÆ’Ã‚Â¨ estremamente cortese e gentile, ti viziano con ogni attenzione  e bontÃƒÆ’Ã‚ . I sedili sono comodi e lo spazio ÃƒÆ’Ã‚Â¨ molto piÃƒÆ’Ã‚Â¹ che sufficiente. Ottimo tutto."
Emirates,9-Oct,ar,"24 April,",,"Travelled with Emirates for the first time and I will certainly be doing so again. Superb service throughout from all staff - extremely friendly, efficient, helpful and professional. High quality standard and food and beverage and a comfy seat."
Emirates,3-Oct,ar,"08 December,",,"I was impressed with advertisement, however reality is quite different. Please AVOID Emirates even if you have to buy expensive tickets...

1. No online check-in, therefore long queues
2. Mishandling of luggage, therefore don't be surprise if you're items are damaged
3. Strictly enforce carry-on luggage to 7 kgs only, therefore you've to check-in everything
4. Once you check-in luggage, there is high possibility of luggage being lost
5. Their IT department sucks, no information/coordination by ground staff
6. Inadequate staff, often overworked and untrained. Staff can be offensive, rude & condescending to customers
7. I was not able select vegetarian meal during booking, and they didn't serve me vegetarian meal. I had to skip my lunch and the staff was unconcerned.
8. There is no coordination by ground staff. They lost my luggage and it's been more than a week now
9 . There is no option to write e-mail or file compliant on their website. They evade it by asking too many details, which you'll not have
10. Most negative feedback is coming from people who deal with Dubai airport, therefore to resolve any issues with luggage, reach out Dubai helpline

To summarize, Avoid Emirates!"
Emirates,9-Oct,ar,"11 January,",,"Only one word Exellent , Crew are really polite and helpful, i really enjoyed my trip, I will choose Emirates for my next trips"
Emirates,6-Oct,ar,"29 August,",,"I travelled Birmingham to Bangalore on 17th Aug with EK40.
Flight got delayed by 27 Hours. Whenever we ask for the reason of delay, member were giving predifined answer like ""flight will depart after 1 hour"".
like that they extended for 7 hours then alotted for hotel. 
Informed us that dinner will be provided in hotel but no information given to hotel and finally we slept without dinner.
Next day vacated hotel morning 8 am but again started same story of ""flight will depart after 1 hour"". Finally departed birmingham @5pm.

Horrible experiance making to think of emirates whenever urgent travel is needed"
Emirates,8-Oct,ar,"08 January,",,"Flew from Shanghai to Dubai. 

What can I say, A380, gigantic screen for movie, specious leg room, in flight wifi(not free). Cant remember too much about the food, but wasn't something I cant accept.  "
Emirates,7-Oct,ar,"06 April,",,"Anysmal ciustomer service.
If things go wrong dont expect any help from Emirates.
Complaints and emails are totally ignored.
They turn a blind eye to anything that doesnt make them money"
Emirates,6-Oct,ar,"16 August,",,"I have used Emirates for many years but lately I am having problems with them one behind the other with my miles and late flights, then they do not want to cover the hotel or food expenses.  I have just being left with my daughters at midnight in JFK without luggage and without hotel.  After that, they rebooked our tickets in a different class of what I bought and they do not want to credit me the right amount of skywards on mine or my daughter's account.  I have call them and write many times without any response..!!!  Second case: We bought another tickets Milan/ Dubai/Milan at a different time, paid in a different currency and in a different class, now they are trying to put all the trip together and give me less miles..!!! Be careful with them, they are not committed with their customers as they used to be before, it is a shame..!!!  "
Emirates,4-Oct,ar,"07 October,",,"On our journey from Dubai to Pakistan we had to sit with a blanket over our faces due to the fact that the whole of that area smelt of sick before, during and throughout the journey we asked to be moved and they said no which we found disgusting as it was a long flight where all we could smell was sick, as we smelt the smell as soon as we got on this made me think that the hygiene was not good at all as it would have been cleaned from the last flight, overall I would not recommend Emriates and their staff are rude stuck up and lazy. "
Emirates,2-Oct,ar,"16 August,",,"The worst service ever! Thieves! Do not use such horrible company.
We lost lot of money because they refused to make check-in. "
Emirates,3-Oct,ar,"28 September,",,"It's one of the worst airlines I've ever flown.

1. I had a very bad experience starting from the check-in counter. The guy didn't allow me to bring my camera gear to cabin since it's exceeding 7kgs. At the end, I had to pay AED 600 for another extra seat so I could bring the bag into cabin. The guy didn't even apologise for the inconvenience and no smile on his face.

2. I spent appx. 90 minutes to get the issue resolved and at the end I had to run fatto the gate as it was closing down

3. There was no welcome face on the plane. Even the stewardess questioned me about my two tickets. It seemed there was no coordination with the ground staff.

4. Aircon inside the plan was very cold and there's no way to turn it down.

5. The flight delayed for one hour. There was no apology from the pilot."
Emirates,8-Oct,ar,"15 May,",,I fly 2 yrs ago with emirates from Australia to england i found every part of my trip enjoyable the food was really good for airplane food esp considering im a extremely fussy eater i ate nearly all of every meal staff were really good and entertainment was superb seats were average but what seat would be comfy esp on a 14hr flight im just lucky I'm tiny so was easier for me than some taller people on issue i had was sitting at the window not able to sleep or get up and down but that was due to my in experience not the lack of staff or airline im due to fly the same route in 12weeks and im looking for to flying emirates again
Emirates,9-Oct,ar,"20 May,",,"I'm amazed at some of the poor reviews. I fly Emirates all the time between US and Mid East, and Mid East and SE Asia. It is a very reliable, on time airline and cabin crew very friendly and helpful. To me, what makes or breaks a good experience are the passengers, and one needs to be very aware that certain nationalities do not discipline children, and are free to scream and impose with total disregard to others. Emirates can't randomly select who they let on board. And while crew frequently bring soft drinks around during a flight, passengers also should be aware that a snack basket with drinks is kept in the galley, to collect at will. Food in economy is on par with other airlines, and if you fly frequently on a route, the menu tends to stay the same. In business, the meals are great, as are snacks in bar area. If I have a complaint, it's not against Emirates, but the congestion at DXB, which can lead to delayed push-backs and holding patterns. I've been a gold card member for years, and will always choose Emirates. They've never let me down."
Emirates,5-Oct,ar,"18 January,",,"I recently took a business class flight from Bangkok, Thailand to Burlington VT. We stopped in Dubai and New York on the way. The last leg of the flight was an economy flight from Jetblue. 

In addition the Emirates destroying my Samsonite hard shell suitcase and refusing to take responsibility, the staff were generally unfriendly and disinterested. Highly disappointed, especially comparing to Qatar Airways"
Emirates,4-Oct,Desire Oosthuizen,"04 March,",,"We lodged a complaint, but was told to put in a refund for our returnable tickets separate. We paid R16900 for returnable tickets and was only refunded R685. The complaints were not even looked at for the delay we had at Manchester airport, then missed our flights at Dubai due to their delay, then booked in at a stinky airport hotel for a flight the next morning. Told us our expenses will be covered, but couldn't even get a glass of water so had to buy refreshments out of our own pockets. We never received our baggage as promised by the airport and was left with no chronic medication and no clean clothes. At the airport, due to their handling we were told to re-wrap our luggage, things that were bought at Manchester airport, sealed, scanned for and with receipts, were confiscated as we were never informed that we cannot leave the airport with it. Now we request a full refund on our return tickets and are told that they don't refund because we already used part of the ticket"
Emirates,7-Oct,ar,"30 April,",,I really was shocked with the seat type at the Business class. I don't know why they have this high partition between the 2 seats and you don't have the room to place your arm. I was very uncomfortable with the 5 hours business trip to Bangladesh. The problem is that Emirates is the only airline that goes there directly. I have no other choice. Don't know how I can manage my next trip.
Emirates,3-Oct,ar,"30 September,",,"Disrespectful staff and poor service.

I have been flying with your airline via many routes, and i have noticed the food served from DXB to IKA (TEHRAN) always seems to be the worst of not just emirates, but any other airline i travel with. This cannot be a coincidence as other friends and colleagues have noticed the same and many complaints have been made without any changes. EMIRATES IS INVOLVED IN PURE DISCRIMINATION and as a customer I do not want to get involved in the current politics between Emirates and Iran, but once a company charges so much for a ticket the least they can do is to provide the same service which they do in many other routes, and not leave the worst food menu for these people who have as much right as anyone else

Please spread the word regarding emirates bigotry and treatment of flights to Iran, I for one will try my best not to fly with your airline again! "
Emirates,5-Oct,ar,"22 March,",,flew emirates from Boston USA to Male in the Maldives....unless you can afford business or first class do it....  the economy class on the 777 was nothing but pure torture.  The crew looked great in their uniforms ....the food in economy was airline food....the seats were nothing short of pure torture. It took almost 20 hrs to reach Male and by then I would have done anything to get off that flight
Emirates,7-Oct,ar,"07 June,",,"Sydney-Bangkok-Dubai,  Boeing 777.
Crew friendly and tasty meals, however the seating is very cramped.
Avoid the 777 its miser"
Emirates,4-Oct,ar,"30 March,",,"Fairly short travel from Sydney to Auckland but got the flavour of this over rated airline! Had requested vegetarian mean but was served non-veg meal. when complained the attitude was 'take it or leave it'!!!
Vowed never to travel by these middle eastern airlines!"
Emirates,10-Oct,ar,"29 June,",,"We flew to Maldives from Cape Town.  We had such a good experience flying with Emirates. On our return, we had Lauren and Antoni who really were exceptional   They really made sure that we had a 5 star experience.  It is because of employees like them, that Emirates gave such a good name. They were fantastic and extremely professional. Thank you so much ch for making such a long flight so pleasant. "
Emirates,10-Oct,ar,"20 August,",,"Flying in first class on the A380 was amazing! You get your own closed off private area, lots of comfortable space and the service was beyond excellent! The bathrooms were spacious and even had showers, so you weren't sitting in a plane for 14 hours smelling. My flight from Sydney to Dubai was amazing! Love Emirates and I look forward to using them again in the future."
Emirates,4-Oct,ar,"16 June,",,"Broken seat, malfunctioning ICE, forgetful crew, below average food, things dropped on me from the trolley.
Overall a very poor experience from what used to be an excellent airline."
Emirates,4-Oct,ar,"28 January,",,"I'm not usually one to complain about airlines because I am a anxious flyer and if I make it safetly on ground I don't worry but this was unacceptable, I was very excited to fly with Emirates until reading reviews and became nervous at such poor ratings for such a airline like Emirates, I feel that if your in economy the service is very poor, we didn't get our meals until 2 hours after take off due to turbulence (understandable) but what I don't understand is why some people did and others didn't or why no hostess came around with water and snacks in the mean time, it was a night flight and no lights were dimmed or turned off until 3 hours in?! I had asked for water quiet a few times to one host and he never gave it to me so finally I asked another hostess and got it straight away, lots of people were complaining around me due to such poor service, we may be economy but we are the majority of your customers so some type of service would be nice, I have flown on cheaper airways with much better service. Except for that, a few hostess were extremely helpful when a baby was crying for majority of the flight and the inflight entertainment was great. "
Emirates,10-Oct,ar,"16 December,",,"We are really happy about our honeymoon flight with Emirates to Dubai on 9th December, 2014 at 2:30 pm from Lagos, Nigeria. we received a warm welcome and reception onboard, the attendants/crew members especially Jessica and Timea were amazing. Thank you for making the start of our marriage journey beautiful.
Regards, 
Oyoenisai Udonte and Anietie Andrew-Essien"
Emirates,9-Oct,Elizabeth Grant,"13 November,",,"I had to travel with my Mum back to London from Brisbane Airport, She need Oxygen on the flight, she is 85 years old... I cannot tell you how amazing the Cabin Crew were... from when we booked in until we arrived at London Airport... The best service all the way... I have traveled many times on this airline... and I don't think I would use anyone else...
GREAT JOB EVERYONE FROM EMIRATES"
Emirates,8-Oct,,"14 February,",,"The A380 is a seriously comfortable plane compared with the alternatives.  It is quieter, and there are fewer issues with air pressure and humidity.  It means you step off the plane feeling so much more relaxed.  We flew on this plane from Dubai to New York and it was a refreshing change from the cramped 777"
Emirates,6-Oct,ar,"22 November,",,"Four flights onboard Emirates a380, while the economy seats and entertainment are very good I'm afraid the same can't be said about the very bland food and miserable service from the cabin crew who on all four flights were totally uninterested in the passengers,to the point of being rude and obnoxious. Not sure what the ""Emirates experience "" is supposed to be but I definitely wasn't feeling it,a real let down. "
Emirates,7-Oct,ar,"18 June,",,Dubai - Khartombe return. Aircraft old model A340. Food on both sectors barely edible. Khartombe - Dubai chicken with potatoes however no chicken in portion. Desert of unknown type. Looked like rice pudding someone had eaten before. Big plus with air crew as tried to do their best with broken porduct.
Emirates,6-Oct,ar,"05 August,",,"My wife and I have regularly flown Emeriates economy but we decided to treat our selves by flying Business class from Manchester  UK to Perth Australia. We Flew in a Boeing 777. At meal time even though we were sitting in the third row of the cabin we were told that we couldn't have our desired meal because other passengers had them.  We were then instructed to select either an Arab dish or an Indian one. Neither was appealing but I selected the lesser of the two evils and selected the Arab chicken meal. I arrived in due course over cooked and dried out and as a result I couldn't eat the dish. I have never had such bad food in Economy with Emeriates.  After a wonderful change over in Dubai we boarded the next 777 for Perth. This time were seated at the rear of the Business section which made us wonder if there would be sufficient food for us this time. Sure enough we were denied our selection and again offered either an Arab dish or or an Indian dish. This time I pointed out to the steward that considering the considerable cost of my ticket I should not have to eat the food that other passengers had declined. After a literally stand up argument the steward said he would see what he could do. In due course he returned with our desired selection which was perfect. This argument over food I found very upsetting and ruined what should have been a wonderful trip for my wife and I. 

We will never travel Business Class with Emeriates again. We would recommend to anyone that unless they like Arab or Indian food they should avoid Emerates like the plague."
Emirates,5-Oct,ar,"24 April,",,"Emirates flight from Dubai to Seychelles. I paid for four airfares for myself and my family and I was travelling with children and ended spending at least 20 minutes on a bus whizzing through Dubai runway to board our flight. Please Emirates it is unacceptable to pack fare paying passengers on a bus with no seating facilities to board a plane stationed twenty minutes drive from the airport terminal (GATE). My daughter was exhausted, my wife broke her shoes through this mayhem. Passenger were falling and tripping over each other each this stupid bus took a turn. This is not what I paid for. I paid for airfares not a bus fare. If you want to use a bus, can it be at least a comfortable service. Provide seating, plan a better route. This is an accident waiting to happen.STOP whizzing people through airport traffic and planes. This is irresponsible, TWENTY minutes???"
Emirates,7-Oct,ar,"16 August,",,"The emirates airline is absolutely hopeless and frustrating when it cones to dealing with aged people when a wheelchair is needed. I have been asking for a wheelchair for one week but they couldnt commit to it due to my mothers stay at Dubai was 8 hours. There is absolutely no guarantee whether the patient will get a wheelchair. So basically you just throw your patient out in the blue and a chance of getting wheelchair is just 50/50. 
When i was frustrated with their services i was tempted to use Marhaba transfer and lounge services. Had to go through the same scrutiny and paid 150 aud for this whole drama. If eimrates airlines spends loads of money on hotels outside airport , why dont they help their customers to book in marhaba lounge. 
I would recommend some other airline when you have aged people with wheel chair requirements."
