Airline,Rating,Reviewer Name,Date,Seat Type,Review Text
Singapore Airlines,8-Oct,Ariline Expert,"30 March,",,"The BEST! Ohhhhhh YES! The BEST among the few BEST; EVER! ?EXCEPTIONAL! 'A' Grade across the board. âœ…
Thank you Singapore Airlines for excellence!?"
Singapore Airlines,10-Oct,ar,"06 July,",,"Still the best of the best. Great food, in-flight entertainment, cabin crew and comfort."
Singapore Airlines,9-Oct,ar,"16 January,",,Good!
Singapore Airlines,7-Oct,ar,"05 July,",,"Travelled London to Singapore on a 380. SIA have a very different view of PE to other airlines. Note their use of 'privilege' and 'priority' in their advertising. PE is simply the front of economy with a flimsy partition between them. They offer a good seat with good features including an exceptional screen and headphones.  Drinks and all other service is with economy; its just you get served first. I have noticed a distinct deterioration in SIA food over the last decade or so, and this flight was no exception. A privilege is to book a special meal. Good idea because the in-flight offerings were not much. However, while plentiful the food was bland and not that well prepared. Wine was served in the smallest glasses I have ever seen on any airline. It was a tasting at best. Further, there was no choice - other than red or white - and the quality was modest. For some reason, the coffee/tea cups were also small. SIA charge plenty for PE, but did not deliver that much. Overall, based on this trip I think Cathay and BA are better value for money and Qantas offers a far better service for about the same cost.  I might take SIA again, but only if I could find no other option."
Singapore Airlines,6-Oct,ar,"14 April,",,"Bed was reasonably comfortable. Food was awful. Mocha/coffee was dreadful. Cabin crew were attentive. Pilots were great, very vocal and could be easily understood. Flight was mostly smooth and comfortable. Bathroom was kept clean. Pleasant flight but food needs an improvement. "
Singapore Airlines,10-Oct,,"12 February,",,"We really love travelling on Singapore Airlines . The staff were excellent , especially Helena, Cai, Philip and Manhas. They were so helpful and friendly. The food was delicious and the drinks great. The seats were comfortable and roomy for economy. Singapore airport is one of our favorite airports in the world, love the orchids and the butterfly enclosure, a very beautiful airport."
Singapore Airlines,10-Oct,ar,"12 August,",,Perth to Tokyo and Osaka to Perth via Singapore.  Had not flown Singapore Airlines for many years and was very impressed.  Nice touch to have a choice of Japanese Meal from Osaka to Singapore.
Singapore Airlines,4-Oct,ar,"14 September,",,I wasnt expecting this from an airline with whom i travelled the most. Flew premium economy class and to my surpirise wasnt even close to what they advertised. Seriously not happy would never recommend
Singapore Airlines,7-Oct,ar,"06 October,",,"Perth Singapore London return. A passenger was using an IPad while aircraft was taxiing so I alerted a cabin staff member who told me it was no longer required not to use electronic equipment during take off and Landing. I pointed out that the fasten seatbelt sign also alerted passengers not to use such equipment. I also took a look at the Safety Information card which also stated the equipment should not be used. I also noted that during the serving of meals the cabin staff did not request that seats be returned to their upright position to enable the passenger behind to be able to comfortably eat their meal. The entertainment system was stop go indicating that the server could not deliver the video without stopping to catch up constantly. The pillow provided had a nasty stain on it and finally, the underside of the toilet seat was covered in long term grime, very unpleasant. Look forward to your response.

EDITORS COMMENT:  Electronic devices can be used in flight mode on many aircraft now. The rules for this will vary between airlines and indeed aircraft but definitely it is ok on Singapore Airlines - provided it is in flight mode.  It is nice when the cabin crew ask passengers to put their seats up at meal times and generally the airline do do that. The airline needs to upgrade the entertainment on some older aircraft definitely and as for the toilet  - you can't really control what other passengers have left behind on a long haul flight. "
Singapore Airlines,9-Oct,ar,"02 March,",,"Travelled on a round trip  from Singapore to LA  From take off to touch down,  experience was generally good. However,  am impress with the efficient service I received from  FA Judy, During my return flight  on  SQ 11 from LA to Sin on 20/2 /17, I was supposed to receive products bought at DFS, LAX at the boading gate but  for some reason  the same never reach me as promised. I seek assistance from the crew,  and was attended by Ms Judy who was so professional and helpful  assuring me that she had sent an email to DFS to find a solution to my problem. Judy was so efficient and helpful throughout the handling of the case and  was able ot provide a personal touch and exude warmth and understanding as well as  communicating updates regularly to me until the aircraft made a layover at Narita,Tokyo. At Narita, I was approached by the ground staff  Yuri who continue to update me with the latest status and she too exercise  patient and responsive to my request.
Kudos Singapore Airline, for having a great team who are committed to excellent customer service and one that makes customer feel respected and valued. Judy and Yuri""s dedication to a client's problem is commendable."
Singapore Airlines,9-Oct,ar,"15 March,",,"Flew Sydney - Singapore- Paris in premium economy. Great seats, extra space very comfortable, food choices great & service as usual, tops. Have now flown with SIA over 15 times and always experienced top quality service & attention . This was our first Premium Economy flights & they were well worth the additional cost, Our return flight in January resulted in an upgrade to Business class for the Singapore -Sydney sector....wow....now we are spoilt ....planning another trip for December 2017...what do we do now !!!"
Singapore Airlines,2-Oct,ar,"07 October,",,"Fucking singapore airlines doesnt care about passengers duty free products,  they always delay in timings, no good service, rude behaviour with passengers i wish nobody should prefer this airlines."
Singapore Airlines,7-Oct,ar,"30 March,",,"Singapore to Hongkong, First week of March.!
The flight was neat and tidy, quite big. Inflight entertainment was good. I don't have enough choices with Breakfast but good though. The Cabin crew must have good training on how to treat passengers, showing an unhappy face all the time that attending flights is the only duty and not serving for passengers. You can feel comfort during travel except the unhappy airhostess!!"
Singapore Airlines,9-Oct,Trace Kan,"11 October,",,"Flew PER-SIN 18/9 and SIN-PER 25/9. Both flights were great with attentive crew. PER-SIN was on a new A350.  Having been the last few trips on Scoot and Jetstar, it was nice to enjoy a full service airline. Lunch consisted of beef rendang with a delicious Maggie Beer ice cream for dessert. IFE system takes a little bit effort to get full use of it.  Sometimes it only offered limited options for music and TV depending on your previous choice.  SIN - PER was on Boeing 787.  We took advantage of early checkin at Jewel Changi so we could have time to explore Jewel. Captain was awesome with giving updates during the flight.  Even though both flights had great crews, I felt on this flight, crew were just a bit more efficient.  Meal was a very delicious chicken in oyster sauce with a Singaporean local brand ice-cream for dessert. I had looked forward to watching part 2 to a series on the IFE that I had watched on my flight the week before but unfortunately could not find on this plane so maybe the IFE varies slightly on different planes."
Singapore Airlines,6-Oct,,"02 January,",,"Having flown with Singapore Airlines over the years and really enjoying their service, our last flight with them was rather disappointing as well as frustrating. Their meals were very average. I had the fish on the return flight and left half of it. My wife was the first to use the toilet and she said it smelt when she went in. Toilet floors were wet with, presumably urine, throughout the flight. They seem to have cut back on the number of flight stewards used to service passengers and the cabin to what they once had. Because our connecting flight was delayed by over an hour, we almost missed our flight for the home leg. Though delays happen of course, there was a lack of communication to passengers about what was happening. Due to the delayed flight our baggage didnâ€™t arrive with our flight. Again, these things happen, but SIâ€™s ground support contractors did not have a record of one of our pieces of luggage. It was a nightmare trying to communicate with the baggage contractors to find out what had happened to our missing luggage."
Singapore Airlines,6-Oct,ar,"23 January,",,Singapore-Yangon-Singapore
Singapore Airlines,7-Oct,ar,"16 August,",,"Recently travelled Perth/Singapore/Paris and then London/Singapore/Perth. The 777s were looking a bit tired but the 380 was good. In the 777 I sat in the aisle seat (centre row) which had reduced foot space so watch out for that one. The entertainment system has a reasonable choice of things to watch but you can't see them all from the beginning. This needs upgrading. Service was very good. The vegetarian meals were average and the non-vege food wasn't much better. All up though, they were okay but will probably try another airline next time."
Singapore Airlines,7-Oct,ar,"24 December,",,Overall a good airline but whoever decided that touch screens were a good idea was not thinking straight that day. Who on earth would you put a device on the back of a head rest that is tapped and pressed to operate!! I traveled from Melbourne to London with the back of my head receiving a sporadic tapping from the passenger behind. If you want to feel what it's like just get the person sitting next to you as you are reading this to rest their iphone against the back of your head while they write a text message. Now imagine that for hours on end. That's what it is line in these daft seats.
Singapore Airlines,5-Oct,Will Ramanto,"23 May,",,"The Good:
- Flight crew is always friendly, helpful and always seeks to cater to your needs
- Food on the flight is great (though I've noticed Book the Cook options to be limited)

The Bad:
- The SQ JFK check-in process (even for business class) is one of the most chaotic and frustrating experiences I've had. It can take up to 30 minutes being in line (for a Business class passenger) &amp; I've encountered a check-in staff who raised their voice to customers. I even witnessed one of the supervisors rolling their eyes and being snarky at a Business class-Solitaire customer (SQ's highest status) who insisted on lining up in the First Class line (which the SQ website says they are allowed to do so). 

Additional: 
- I've been having issues with missing miles on Singapore's Krisflyer and my interaction with SQ customer service has been a nightmare. It's been 6 months now since I've had the issue, and 4 months since I've flagged the issue to Singapore Airlines customer service, and it has yet to be resolved. It's a shame to see what used to be a great airline fall from grace this quickly and this badly."
Singapore Airlines,4-Oct,,"25 May,",,"We flew FRA -&gt; SIN -&gt; CEB. First leg was Singapore, 2nd was Scoot. Both items of luggage got lost in SIN It took them two and four days to make the luggage available at the destination airport, where I had to pick it up myself. Singapore Airways refers me to Scoot to bargain for a compensation which ""we decide on a case by case basis after you prove your expenses"". Back in Germany I call their hotline (+49 69 7195-200), but it's busy like ""all our agents are busy, call again later"". We flew economy in an A380, seats were older than that plane exists. On board entertainment was ancient."
Singapore Airlines,6-Oct,ar,"14 May,",,"I'm a frequent flyer. My first time with Singapore airline shocked me. The rudeness of their service is appalling. To start with, maybe a smile will help but instead of being friendly this steward insist of being offensive, I can understand he's being treated badly by a couple of Japanese in front of me. It may just be a language barrier. So this jerk choose to deal with this experience by being rude  to everyone in the vicinity. I wish I got his name. He should be fired!"
Singapore Airlines,7-Oct,ar,"22 August,",,"Basically, even though a decent airline, the economy coach baggage allowance of 23kg per luggage piece is simply unreasonably low for international travel. A minimum of 32kg is standard, and the least amount a traveler should be forced to comply with. Had I known Singapore Airlines had such a useless baggage policy, I would have booked my fare on another airline. The kg overages for zone 3 travel are 16$USD PER KILOGRAM. This is an exorbitant and unreasonable rate versus fuel costs. In future I will not be booking any travel on Singapore Airlines. That's not called customer service; it's called extortion."
Singapore Airlines,10-Oct,ar,"04 June,",,"2th time we flew with SQ to Bali. This time we flew from Dusseldorf. Smooth check in , smooth boarding.  Very good inflight service although one off the flight attendants seemed very stressed to me. She even  didn't make eye contact during inflight service when handing out food or drinks. Good inflight entertainmant system . Smooth touch  down in SGP. "
Singapore Airlines,0 / 10,ar,"14 June,",,"Terrible customer service

I travelled with a group of 35 high school students fro Australia to France. Due to a schedule change by Singapore Airline we missed our connection in Zurich, even though it had been a one-ticket fare. The worst was that Singapore Airlines offered very little help and absolutely no assistance  for what ended either as a 12 hour layover in Zurich or a forced airport change in Paris, from CDG to ORY. Under the ridiculous pretext of 'that it had not been part of our initial ticket' they refused to arrange a connection from Zurich via Geneva to our destination Nice.  And they refused to arrange or pay for  the coach I had to arrange between the two airports in Paris. Our experience with Singapore Airlines customer care was TERRIBLE. "
Singapore Airlines,8-Oct,ar,"25 March,",,Overall fair service !
Singapore Airlines,10-Oct,ar,"10 February,",,"Yesterday i flew from Perth to London, via Singapore, with Singapore Airlines. They are currently my favourite airlines to fly with.
The flight staff are amazing! They are genuinely happy and friendly. They seem to be continually offering you a service, but not obtrusively.
They think of things before you do. Like , offering you a drink, more food, collecting your rubbish, taking away your tray!   No sitting with an annoying tray blocking your exit from your seat or restricting your movement for hours!! They even remember what you drink!!!! They warned me that my food choice could be spicy, was i ok with that?
The long flight was enjoyable and I caught up on some great movies and slept well for an economy airline flight. Congratulations on a job well done and excellent pride in your work. 
Thank you."
Singapore Airlines,7-Oct,ar,"07 October,",,"Singapore to Brisbane SQ176. I travelled with my 11 year old and 16 year old ( on a single booking number) and we were all seated in completely different rows. Our travel agent asked us to confirm the flight which was done in Vietnam by the hotel concierge the day before, and we went on a Silk Air Singapore Airlines flight the day before. They were aware of our ongoing arrangements as they asked if we wanted to put the bags through or not(we had a 1 night stop in Singapore). The check in counter lady in Singapore  was rude and said that the flight was full and it was bad luck and she could do nothing. On my insistence she relunctantly looked and put the children together in row 55 and me in row 46( different cabin). After going to the boarding gate I pleaded with them to see if anything could be done and they quickly were able to change a seat with a single traveller. My family was upset and my little boy was crying but the staff had no compunction to let a child who had the same booking number as his mother , fly an 8 hour international flight alone. 0/10 Singapore Airlines!!"
Singapore Airlines,9-Oct,ar,"12 March,",,Good service and communication. Comfortable too!
Singapore Airlines,10-Oct,ar,"26 June,",,Singapore airlines are terrific their quality of service is second to none. That great service starts right from the booking experience where we had to contact staff over an online booking recently. Helpful and polite always. We fly very frequently to the UK from Auckland and have done so since 1980 we have flown SIA many times during that period although I will say not exclusively. We have always come back to SIA because of the poor service on some of these other airlines. The age of SIA fleet is one of the youngest in the world and they are maintained in tip top condition. A big attraction too for kiwis is that they fly to Singapore direct from Auckland unlike some of their Gulf and Aussie competitors who have other stops that add to the journey time
Singapore Airlines,4-Oct,ar,"14 December,",,"My husband flew business from melbourne to manila and found business to be less then fair..the food was poor , the seating old and shabby, comparef to garuda which we flew from Amerstedam to Jakarta  which was amazing food , service and comfortable. .Singapore  airlines needs to pick up its act ...would never recommended  spending  the money to fly business with them again..."
Singapore Airlines,10-Oct,ar,"09 January,",,"Living in Adelaide we don't have much choice, but have to say SQ's service is one of the better choices we can choose. Travelling on Dec 25 I didn't think it would be busy, but a full flight. Staff were professional and pleasant, service was excellent. Plane was an older A330 but clean and comfortable. IFE great and the food was professional plated and vast. You can't be hungry on a SQ flight from ADL. "
Singapore Airlines,9-Oct,ar,"02 February,",,"Just recently flew Singapore Airlines from AKL-SIN-BOM and back. I fly frequently with SQ and i have to say their inflight service always is the best no matter what, however i was kind of disappointed with the A380 aircraft on my route from AKL-SIN. I do understand that the aircraft they use is about 8 years old now but their economy class seats are quite uncomfortable for a 10 hour flight. I wont complain about IFE systems they are ok, does not have touchscreen like its competitors Emirates, Korean, Thai etc. I much prefer their Boeing 777 aircraft economy as the seats are spaced out atleast. Apart from that i have no complaints for SQ, i only wish they upgrade their economy like how Emirates has now on most of their aircrafts to better seats and bigger screens."
Singapore Airlines,4-Oct,,"05 November,",,"Having used Singapore Airlines extensively (Solitaire member) over the past few years I am quite disappointed with Singapore Airlines and find the over rated, expensive and little value for money. As I flew return to New York for the first time (I normally go east via Japan) this was a very poor experience, not only in the air but on the ground as well. In essence you are treated as a ""transaction"" on the ground and in the air. The food offered is very poor. I have given up on the chicken satay that is being served on every flight as starters as they are dried out, poor quality and when you add that the choices are quite messy as ""warmed up food"" normally is. My wife had given up on Singapore airlines and flew to London via Hanoi with Vietnam airlines and she said, twice the service at half the cost in Business class. I will try this route on my next time as they seem hungry to deliver service and at a reasonable price where I am not at all happy with Singapore Airlines although I have used them extensively in the past. From now on, I will spread my patronage with local airlines ( not SILK) as they seem very motivated to serve whereas Singapore Airlines seems arrogant and take your patronage for granted."
Singapore Airlines,6-Oct,ar,"09 May,",,"I used to be a loyal SQ frequent flyer. But not anymore. SQ really need to improve their service. Seriously, once in a while I take coach, and the service are terrible!!! First, a smile wouldn't hurt. If all of you somehow managed to hurt ur jaw and can't smile, at least do not look annoyed. I frequent travel in First or Business so-so service, somehow they managed to smile in these part of the plane. Travel with a child? Strongly suggest another airline. This one is not child friendly at all... 
Once I travel in coach with a broken seat (slightly reclined, around 2 cm). One of the crew asked me to change seat during take off and landing, ok no problem, for safety reason, Got that. BUT with attitude. She said to me, ""MAM, you can't seat here, you need to move with ur baby."" She moved me to business class and right after take off she said ""Mam, u need to move back now, this is business class area"". Seriously?!? Now I fly any other airlines, Garuda, Emirates, ANA, Korean Air, top notch service, good food as well. So SQ, hospitality 101 for your crew is urgently needed!!!"
Singapore Airlines,9-Oct,ar,"22 December,",,"Very good airline to travel with, everything was done how you would expect from a premium carrier. Always depend on the same high standard of service its a credit to the airline."
Singapore Airlines,2-Oct,ar,"11 December,",,"Terrible non existent customer service. I can't believe Changi does not even have a person from SQ direct to assist their passengers and the one person they had on duty could not do a thing. Needless to say it took 5 hours before we even speak with him.  He was a puppet with no discretionary authority to approve anything whatsoever.

Flight out of Guangzhou late due to late arrival of inbound from Singapore. Arrived Singapore with just enough time to transfer to gate with more than 15 mins before flight would have left but were told they would not let us on connecting flight. I didn't care about my baggage transfer made no difference.They changed us to flight 6 hrs later arriving  5.20am. Not good working at 8am with clients and patients. Need sleep, could not pay to upgrade to business to get some sleep short of $3500 one way per pax. What a joke. Preprared to pay reasonable but not $3500!

Add vouchers given had a wrong date next day, so couldn't be used!!!!

Service so bad, systems awful. One and only actual SQ staff in the whole of Changi airport, rest of staff outsourced to Changi airport. They had absolutely no authority at all. Complete disgrace.

Zero rating "
Singapore Airlines,8-Oct,ar,"10 November,",,"Flew from Brisbane to London on 3 November 2015 with a four-hour layover at Changi airport. I have always found Singapore staff to be very efficient and functional rather than 'friendly' and this experience was no different. This is not necessarily a bad thing - frankly I prefer a 'direct' approach when getting from A to B. Nonetheless, the flight was comfy and the food and entertainment good for both legs (regionally Cathay Pacific for me have the edge with food). While Singapore can be expensive if you catch one of their quick-fire sales you can secure a great deal. 
EDITORS COMMENT: couldn't agree with you more  - you're exactly right!"
Singapore Airlines,9-Oct,ar,"05 July,",,Very good experience I had during my journey from India to Australia. The attendants are really good and supportive. Traveling with a kid alone I find the crew more supporting and accomodating
Singapore Airlines,0 / 10,Josh Cairns,"26 July,",,"3 years agio this business class product used to be a quality one. Now it is absolutely awful. Aircraft is messy, old and dirty, but that's not even the headline of awful. It is the staff. From the minute you enter the lounge to the time you exit the flight, it is so unpleasant bordering on hostile. I have never experienced a worse business class airline experience in my life, and I can't even imagine how bad the economy class must be!!!"
Singapore Airlines,9-Oct,ar,"13 December,",,"I have always traveled by Singapore airlines for all my international trips and never had a problem with them. The inflight experience, quality of food and beverages were of high standards. Would definitely recommend this airline to everyone, never had a problem with SIA. "
